{
  "acyclic_required": [
    [
      "core_a1_identity",
      "core_a2_tasks",
      "core_a3_run_ledger",
      "core_a4_approvals",
      "core_a5_lifecycle",
      "core_a6_artifacts",
      "tool_b1_registry",
      "tool_b2_quality",
      "tool_b3_contracts",
      "tool_b4_guardrails",
      "tool_b5_broker",
      "tool_b6_runtime",
      "tool_b7_write_intent",
      "tool_b8_commit_simulation",
      "tool_b9_local_transaction",
      "tool_b91_recovery",
      "tool_b92_observability",
      "emp_a1_work_inbox"
    ]
  ],
  "baseline_head": "e1b6b5c192f938085d8148d45b74d2b97e54df8c",
  "capabilities": [
    {
      "allowed_dependencies": [
        "finalis.audit",
        "finalis.models"
      ],
      "canonical_owner": "finalis/actions",
      "canonical_paths": [
        "finalis/actions/"
      ],
      "capability_id": "action_communication",
      "classification": "product_engine",
      "display_name": "Action Communication",
      "extension_points": [],
      "forbidden_dependencies": [
        "finalis.ai_employee"
      ],
      "permission_namespaces": [
        "action"
      ],
      "purpose": "Action & Communication — gate/consent/rate-limit/route/compose/approve/schedule/send/track (mock delivery).",
      "replacement_policy": "DO_NOT_REBUILD",
      "route_namespaces": [
        "/actions"
      ],
      "spec_anchors": [
        "docs/audit/AUDIT_TRACE_1_MASTER.md",
        "docs/architecture/FINALIS_1000_MASTER_ARCHITECTURE_LOCK.md"
      ],
      "table_namespaces": [
        "action_requests",
        "delivery_events",
        "executions",
        "message_drafts"
      ],
      "test_anchors": []
    },
    {
      "allowed_dependencies": [
        "finalis.audit",
        "finalis.models"
      ],
      "canonical_owner": "finalis/governance",
      "canonical_paths": [
        "finalis/autonomy.py",
        "finalis/certainty_core.py",
        "finalis/governance/",
        "finalis/scoring.py",
        "finalis/state_machine.py"
      ],
      "capability_id": "agent_runtime_governance",
      "classification": "product_engine",
      "display_name": "Agent Runtime Governance",
      "extension_points": [],
      "forbidden_dependencies": [],
      "permission_namespaces": [
        "access_log",
        "governance"
      ],
      "purpose": "Agent Runtime Governance & Observability — trace redaction, policy gate, budgets, scores, flags, autonomy, scoring, state machine.",
      "replacement_policy": "DO_NOT_REBUILD",
      "route_namespaces": [
        "/governance"
      ],
      "spec_anchors": [
        "docs/audit/AUDIT_TRACE_1_MASTER.md",
        "docs/architecture/FINALIS_1000_MASTER_ARCHITECTURE_LOCK.md"
      ],
      "table_namespaces": [],
      "test_anchors": []
    },
    {
      "allowed_dependencies": [
        "finalis.audit",
        "finalis.models"
      ],
      "canonical_owner": "finalis/audit.py",
      "canonical_paths": [
        "finalis/audit.py"
      ],
      "capability_id": "audit_chain",
      "classification": "cross_cutting",
      "display_name": "Audit Chain",
      "extension_points": [],
      "forbidden_dependencies": [],
      "permission_namespaces": [
        "audit"
      ],
      "purpose": "Tamper-evident hash-chained audit log.",
      "replacement_policy": "DO_NOT_REBUILD",
      "route_namespaces": [
        "/audit"
      ],
      "spec_anchors": [
        "docs/audit/AUDIT_TRACE_1_MASTER.md",
        "docs/architecture/FINALIS_1000_MASTER_ARCHITECTURE_LOCK.md"
      ],
      "table_namespaces": [
        "audit_events"
      ],
      "test_anchors": []
    },
    {
      "allowed_dependencies": [
        "finalis.audit",
        "finalis.models"
      ],
      "canonical_owner": "finalis/case_services.py",
      "canonical_paths": [
        "finalis/case_services.py",
        "finalis/completion_loop.py"
      ],
      "capability_id": "case_graph",
      "classification": "product_engine",
      "display_name": "Case Graph",
      "extension_points": [],
      "forbidden_dependencies": [
        "finalis.ai_employee"
      ],
      "permission_namespaces": [
        "case"
      ],
      "purpose": "Case Graph — case structure, missing-info, promises, NBA, action gate, completion loop.",
      "replacement_policy": "DO_NOT_REBUILD",
      "route_namespaces": [
        "/cases",
        "/completion-loop"
      ],
      "spec_anchors": [
        "docs/audit/AUDIT_TRACE_1_MASTER.md",
        "docs/architecture/FINALIS_1000_MASTER_ARCHITECTURE_LOCK.md"
      ],
      "table_namespaces": [
        "cases",
        "missing_items",
        "promises",
        "transcripts"
      ],
      "test_anchors": []
    },
    {
      "allowed_dependencies": [
        "finalis.audit",
        "finalis.models"
      ],
      "canonical_owner": "finalis/dashboard.py",
      "canonical_paths": [
        "finalis/dashboard.py",
        "finalis/dashboard_html.py"
      ],
      "capability_id": "command_center",
      "classification": "product_engine",
      "display_name": "Command Center",
      "extension_points": [],
      "forbidden_dependencies": [
        "finalis.ai_employee"
      ],
      "permission_namespaces": [
        "dashboard"
      ],
      "purpose": "Case Command Center — dashboard service + server-rendered view.",
      "replacement_policy": "DO_NOT_REBUILD",
      "route_namespaces": [
        "/dashboard"
      ],
      "spec_anchors": [
        "docs/audit/AUDIT_TRACE_1_MASTER.md",
        "docs/architecture/FINALIS_1000_MASTER_ARCHITECTURE_LOCK.md"
      ],
      "table_namespaces": [],
      "test_anchors": []
    },
    {
      "allowed_dependencies": [
        "finalis.audit",
        "finalis.models"
      ],
      "canonical_owner": "finalis/ai_employee/identity.py",
      "canonical_paths": [
        "finalis/ai_employee/authority.py",
        "finalis/ai_employee/identity.py",
        "finalis/ai_employee/store.py"
      ],
      "capability_id": "core_a1_identity",
      "classification": "governance_core",
      "display_name": "Core A1 Identity",
      "extension_points": [],
      "forbidden_dependencies": [],
      "permission_namespaces": [
        "ai_employee"
      ],
      "purpose": "CORE-A1 AI Employee identity + authority boundary.",
      "replacement_policy": "DO_NOT_REBUILD",
      "route_namespaces": [
        "/ai-employees"
      ],
      "spec_anchors": [
        "docs/audit/AUDIT_TRACE_1_MASTER.md",
        "docs/architecture/FINALIS_1000_MASTER_ARCHITECTURE_LOCK.md"
      ],
      "table_namespaces": [
        "ai_employees"
      ],
      "test_anchors": []
    },
    {
      "allowed_dependencies": [
        "finalis.audit",
        "finalis.models"
      ],
      "canonical_owner": "finalis/ai_employee/tasks.py",
      "canonical_paths": [
        "finalis/ai_employee/task_store.py",
        "finalis/ai_employee/tasks.py"
      ],
      "capability_id": "core_a2_tasks",
      "classification": "governance_core",
      "display_name": "Core A2 Tasks",
      "extension_points": [],
      "forbidden_dependencies": [],
      "permission_namespaces": [
        "ai_task"
      ],
      "purpose": "CORE-A2 Secure Work Intake Registry + Canonical Task Contract.",
      "replacement_policy": "DO_NOT_REBUILD",
      "route_namespaces": [
        "/ai-tasks"
      ],
      "spec_anchors": [
        "docs/audit/AUDIT_TRACE_1_MASTER.md",
        "docs/architecture/FINALIS_1000_MASTER_ARCHITECTURE_LOCK.md"
      ],
      "table_namespaces": [
        "ai_task_intake_events",
        "ai_task_transitions",
        "ai_tasks"
      ],
      "test_anchors": []
    },
    {
      "allowed_dependencies": [
        "finalis.audit",
        "finalis.models"
      ],
      "canonical_owner": "finalis/ai_employee/run_ledger.py",
      "canonical_paths": [
        "finalis/ai_employee/run_ledger.py",
        "finalis/ai_employee/run_store.py"
      ],
      "capability_id": "core_a3_run_ledger",
      "classification": "governance_core",
      "display_name": "Core A3 Run Ledger",
      "extension_points": [],
      "forbidden_dependencies": [],
      "permission_namespaces": [
        "ai_run"
      ],
      "purpose": "CORE-A3 Causally Verifiable Run Ledger + Event-Sourced Replay.",
      "replacement_policy": "DO_NOT_REBUILD",
      "route_namespaces": [
        "/ai-runs"
      ],
      "spec_anchors": [
        "docs/audit/AUDIT_TRACE_1_MASTER.md",
        "docs/architecture/FINALIS_1000_MASTER_ARCHITECTURE_LOCK.md"
      ],
      "table_namespaces": [
        "ai_run_events",
        "ai_runs"
      ],
      "test_anchors": []
    },
    {
      "allowed_dependencies": [
        "finalis.audit",
        "finalis.models"
      ],
      "canonical_owner": "finalis/ai_employee/approvals.py",
      "canonical_paths": [
        "finalis/ai_employee/approval_decisions.py",
        "finalis/ai_employee/approval_store.py",
        "finalis/ai_employee/approvals.py"
      ],
      "capability_id": "core_a4_approvals",
      "classification": "governance_core",
      "display_name": "Core A4 Approvals",
      "extension_points": [],
      "forbidden_dependencies": [],
      "permission_namespaces": [
        "ai_approval"
      ],
      "purpose": "CORE-A4 Human Approval Gate + non-transferable grants.",
      "replacement_policy": "DO_NOT_REBUILD",
      "route_namespaces": [
        "/ai-approvals"
      ],
      "spec_anchors": [
        "docs/audit/AUDIT_TRACE_1_MASTER.md",
        "docs/architecture/FINALIS_1000_MASTER_ARCHITECTURE_LOCK.md"
      ],
      "table_namespaces": [
        "ai_approval_"
      ],
      "test_anchors": []
    },
    {
      "allowed_dependencies": [
        "finalis.audit",
        "finalis.models"
      ],
      "canonical_owner": "finalis/ai_employee/lifecycle.py",
      "canonical_paths": [
        "finalis/ai_employee/lifecycle.py",
        "finalis/ai_employee/lifecycle_store.py"
      ],
      "capability_id": "core_a5_lifecycle",